"Ta7taden 2al be7ar turkeya min thalath jehat: ba7r 2eje min 2al gharb, 2al ba7r 2al 2aswad min 2al shamal, wal ba7er 2al mutawasset min 2al janub."
"Wajadat assulutat al-ustraliyya lil tawasul wal i3lam (ACMA) annahu 3la raghmi min bath al-vidyo 3ala al-internet, fa lam yantahik Big Brother qawanin arraqaba 3ala al-mu7tawa 3abra al-internet haythu lam yatim takhzin al-wasa2et 3ala mawqe3 Big Brother."
"Tamma ta2jil khutat taslim al-luqa7 ila al-manatiq al-akthar tadaruran tarikhayan hadha al-3am, bi-sabab naqis al-tamwil wa inkhifad al-awlawiyya bi-nisba lil amrad al-ukhra."
"wa nazaran li wujud estjabah ma7dudah li hadhihi al munawarat, fa enna almaniya tawaqa3at radan mushbihan 3ala 7arb al ghawasat ghayr al ma7dud."
"Fi ba3dh al-qitarat al-3abira lil-7udud, tujra 3amaliyat attaftish fil qitar al-muta7arrik wa yajib 2an yakun ladayka huwiya sali7a 3inda rukub a7ad hadhih al-qitarat."
"Yumkin lil musـafirin al-mutajihin ila dawla tafridh dhara2ib bahidha, tuwaffir qadr kabir mina al-mal fi ba3dh al-a7yan, wa khususan 3ala muntaat ka-almashrubat wa ttabgh."
"Tata9amman alkhayarat al-ukhra almustanida ila al-iqa3 al7ayawi shorb alkathir mina assawa2il (khassatan alma2 aw alshay, a7ad mudirrat albawl alm3rufa) qabla alnawm, mimma yujbir alshakhs 3ala annuhudh lil tabawwul."
"Tu3tabar mushahadat azhar al-karaz, al-ma3rufa bi ism hanami, juz2an min al-thaqafa al-yabaniya mundhu al-qarn al-thamin."
Qad yatasabbab tul al-yawm fi fasl assayf fi 7uduth mushkila tata3allaq bil-7usul 3ala qistin kafin mina annawm wa ma yusa7ib dhalika min mushkilat si7iya.
"Kun mutma2innan anahu bi mujarad wusulik ila al marasi, sayakun kol shay2 wadi7 jiddan. Sawfa tuqabil mutanazzihin akharin bil qawarib wa sayusharikuna ma3lumatihim ma3ak."
"3inda 3awdatika ila al-watan ba3da al-3aysh fil kharej, takun qad ta2qlamta ma3a aththaqafa al jadida wa faqdta ba3da 3adat watanik al-um."
Addar al-bayda2 hiya wa7ida min aqal al-amakin ithara lil ihtimam li ttasawwuq fi kul al-maghrib.
"Yu3tabar Sundarbans akbar 7izam sa7ily yatashakkal min ashjar al-mangrove fil 3alam, wa yamtaddu li-masــafat 80 kilometr (50 mile) dakhil al-manatiq anna2iya bi-Bangladesh wal Hind min assa7il."
Ta3tamid jami3 ajhizat alcomputer almustakhdama 7aliyan bi shakl fi3ly 3ala mu3alajat alma3lumat almushaffara fi shakl arqam thuna2iya.
"Yalzam wujud mamar Angkor li dukhul al-ma3bad, li-dhalika la tansa i7dhar jawaz safarik 3inda attawajuh ila Tonle Sap."
Wa yablagu qitir jami3 madakhil al-kahif al-lati summiyat bi”The Seven Sisters” ma la yaqillu 3an (328 ila 820 qadam).
"Tu3addu Tokyo al-madina al-asyawiya alwa7ida allaty istadhafat dawratayn min al-olimpiyat assayfiya, wa dhalika ba3da 2an istadhafat dawrat al-al3ab al-olimpiya fi 3am 1964."
"Tammat siyaghat mashru3 al-qanun al-asli min qibal 3umdat Sao Paola al-sabiq, Marta Suplicy. Wa asba7a al-tashri3 al-muqtara7 ba3da ta3dilihi"
"Wa ashara ila al-sha2i3at bi annaha ""tharthara siyasiyya wa sakhafa."""
Kana hunaka 3asrun ghayru mustaqirren aydan bayna kol sulala lil muqata3at almuqassama. Ashhar hadhihi al fatarat kanat 7iqbat al mamalik aththalath al lati istamarat 60 3aman bayna usrat Han wa usrat Jin.
"Fi 3am 1970, iktishaf attabib wa 3alm al-ab7ath Raymond Damadian asas istikhdam attaswyr bil ranyn almaghnatisi bi i3tibariha addat lil tashkhis attibi."
"Tashmal al amthila atta7akum wa attakhtit wal jadwala, wal qudra 3ala al-ijaba 3ala tashkhisat al-3umla2 wa as2ilatihim, bil idafa ila atta3aruf 3ala khat alyad wa assawt wa al-wajh."
"Itha kunta 8ad shahadta film National Treasure, fa 8ad taa3ta8id anna khari6ata al-kanz 8ad kutibat 3ala '6ahr i3lan al-isti8lal."
"Fi makkuk annaql addinamiki hadha, yartabit aljami3 bi tariqatin ma bi nizam naql ya3tamid 3ala assayarat alkhasa wa yad3amuha."
"7atta law kunta taqud sayyaratak 3abra al-ghabat al-matira shibih al istiwa2iyya, fa inna bidh3a thawani ma3a fat7 al abwab athna2 dukhulik as-sayyara waqunt kafi lil ba3udh li rukub as-sayara ma3ak."
Al-3uduw arra2is fi jihaz al-dawra ad-damawiyya huwa al-qaleb al-ladhi yadhukh ad-dam.
Taduru nazariyat almu7tawa 7awla iktishaf ma yu7afiz annas aw yajtadhibuhum.
"Ba3da an ta3tad 3ala attansiq wal ta7rir 3ala al web, yumkinuka la7iqan insha2 mawqi3ika al khass."
"Bi nisba li 2ula2ika aladhina laysu 3ala diraya bi almustala7at altibiya, fa inna kalimat almu3diya wa alsariya laha ma3ani mukhtalifa."
Laqad sa3ada taswiruha al-mutakarrir fil musiqa wal aflam wal 2adab wal thaqafa asha3biya fi ja3l al-madina wa ma3alimiha ma3rufa fi jami3 an7a2 al-3alam.
"Kama wa3adat al-7ukumat bi3idati malayin min amubulat lu8a7 altihab addima'3, mima sayusa3id fi e3dad al-wakalat a9i7iyti lil3am al-mu8bil."
"Bada2a Cuomo, al-baligh min al-3omor 53 3aman, fi mansibihi ka 7akim fi waqten sabeq min hadha al-3am, wa waqqa3a 3ala mashru3 qanun al-shaher al-madi yusharri3 zawaj al-methliyyin."
Wa a3lanat al-sayida Krichner 3azmaha al-tarashu7 lil-ri2asa fil al-masra7 al-arjentini wa huwa nafes al-makan al-ladhi kanat tabda2 fihi 7amlatiha al-intikhabiyya 3am 2005 li majles al-shuyukh bi-sifatiha 3udwan fi wafed  mu7afazat Buenos Aires.
"Yurja an tatdhakkar annaka tazur mawqe3 li miqbara jam3iyya, bil idafa ila anna al mawqe3 lahu ma3na la yumkin wasfuhu bi kalimat bi nisbati li juz2 kabir min sukkan al 3alam."
Ghaliban ma yakunu al wusul ila hadhihi al khadamat min khilal raqm hatif majjani yumkinu al itisal bihi min mo3dhm al hawatif duna muqabil.
"Ba3da rasm khara2i6 li 8a3 al-ba7r, tamma al-3uthur 3ala al-7u6am bistikhdam markaba ta3mal 3an bu3d."
Tumaris majarrat darb al-tabbana 8uwwa 3ala majrrat al-qaws al-qazama kama hawa al-7al binnisba lil8uwwa al-lati yumarisuha al-qamar 3ala al-2ar'9 mma yatasabbab fi 7uduth al-mad wal-jazr.
Yarghab al-3ulama2 fy fahm kayfiyati takkawun al-kwakib wakha9a kayfiya takwyn al-ar'9 munth 2i96idam al-muthannbat bil2ar'9 munth fatratin 6awyila.
Tatbiqat mutarjim alnusus fil waqet al fi3iliy- hiya tatbiqat asba7at qadira 3ala tarjamat ajza2 kamila min alnnas min lugha ila ukhra bi shaklin 2aliy.
Yusamma hadha al-raqem al-hydrojiniy lel maddah al-kimya2iyya. Wa yumkinuka e3dad kashf bi este5dam mashroub al-malfoof al a7mar.
"5etaman, qaddamt ferqat 2al raqs 2al Turkeyya ""nar 2al 2anadol"" , 3ard ""Terwada""."
"Fi awakher 3am 2017, dhahara Siminoff fi barnamej tasawwuq telefizyoni 3ala qanat QVC."
Ta3malu al3alaqat bayna 3ilm amradh addimagh wa ssuluk 3la da3m al3ulma2 fi ba7thihim.
"Istakhdama Hershey wa Chase al3athiyat, aw alvirusat, li zar3 al7imdh alnawawy alkhas bihima fi biktirya."
"Adhara a7adu koktel al-ajsam al-mudhadda ZMapp nata2ija wa3idatan fi hadha al-majal, laken asharat addirast arrasmiyya ila annahu aqal fa2idatan mimma huwa matlub fi taqlil 7alat al-wafat."
"Athna2 3amal Liggins fil mustashfa, bada2a yab7ath fi majalat al-welada al-mubkira fi awqat faraghihi."
"Tatadhaman azziyara ""al-mu3tada"" assafar ila matar Orlando addawly, thumma al-2intiqal bil 7afila ila a7ad fanadiq Disney fil mawqi3, wa qadha2 7awaly 2usbu3 duna mughadarat munsha2at Disney, wa ba3da dhalika ya2ty maw3id al-3awda ila al-watan."
"Ila janib 7amlih li thalath adawat 3ilmiya muhimma, 7amila al-misbar al-8amari ay'9an 9urata al-3alam al-wataniy al-hindiy marsuma min jami3 al-jihat.."
"Kana hadha al 2ustul bi qiyadat Olaf Trygvasson, wa houwa muwaten Narwijiy ya6ma7 li esti3adat biladihi min al haymana al Danimarkiyya."
Tuwajjih al Khutut al Jawwiya Atturkiyya ri7lataha ila 39 wujha fi 30 balad Afriqiy min 2014
"Qad yakun dhalika khatiran idha sa3a al-musafir wara2 as-sarab, wa ehdar a66aqa al-thamina, wal miyah al-mutabqqiya."
La yazalu al-tasdiq 3ala attaswit ilzamiyyan min qibal lajnat IOC bi-kamil a3da2iha fi ijtima3iha fi Oktober/tishrin al awwal fi Kopenhagen.
Wajaha Lwasaki al-3adid mina al-mashakel khilala ri7latihi.
"Mara9 attasallub al3asaby almuta3addid 3ibara 3an maradh yusib alghaz al3asaby almarkazy, wa alladhy yatakawwan min almukh wa al7abl alshawky wa al3asab albasary."
Qaddama la3ibu al-madreb min al-daraja al-mutawasita Sachin Tendulkar wa Rahul Dravid ada2an jayyidan wa aqamu 100 sharakat.
Wa hadha al amr yaj3al min assa3b estekhdam al 3adasat al muqarraba al rakhisah fi zuruf al eda2a al munkhafida dun flash.
"Fi qitarat annawm allayliya, yumkin lil-mu7assil istilam jawazat assafar 7atta la taqta3a nawmak."
"Bi-raghem min ta3liqatihi, illa annahu qala innahu sayad3am ak-mutanafisin al-britaniyin fi ulimbiyad 2011 al-lati tuqamu fi London."
"Ba3da wuqu3 al-7adith, tamma na8l Gibson ela al-mustashfa lakinahu tuwufiya ba3da thalika bi wa8tin 8asir"
Qad yujad almazid mina al mintaqa al-mudhlima (maria) 3la aljanib alqarib wa dhalika li anna alqishra araq kana su3ud al7imam alburkaniya ila assat7 2amran sahlan.
"Lil-qiyam bi nuzha li yawm wa7id 3ala tul darbin sahl, yajibu al-qiyam bi-ba3dh al-isti3dadat, wa yumkin li ayi shakhs dhi liyaqa mutawassita al-istimta3 biha."
Yata6allab al amr saru5an 3emlaqan yazid ertifa3ahu 3an 100 qadam li wadhe3 qamar sina3iy aw teleskob fil fadha2.
"Idha kana mujarad iltiqat sura li shay2in ma ghayr masmu7 bihi, fa la yajib 2an tufakira 7ata fi tasjil maqati3 vidyo."
"Asba7a jihaz ASUS Eee, al-ladhi tamma itlaquhu 3alamiyan fi waqtin sabiq li 3awamil tawfir al-takalif wal waza2if, mawdu3an muhimman fi 2007 Taipei fi shaher teknolojya al-ma3lumat."
Hunak 8ala8 min 2i7timaliyati 2istimrar al-mar'9a fy e9abati al-mazyd min al-ashkha9 bi2ittiba3 rwtinihim al-yawmyi etha 2istamarrat a3ra'9 al-2infuluwnza khafyfa.
"Tartabitu bu7ayrat Onega bi naher Volga, lidha fa inna al-ma2 al ladhi ya2ti min ba7er Qazwin 3abra Russya la yazalu wusulahu mumkinan."
"8arrarat Bashman, allaty fazat bi istitla3 Amis Stru fi Aughustus, inha2 7amlatiha."
"Wa mundhu dhalika al-waqit, tadakhalat al-7ukuma al-fidraliyya li tawalli tamwil mustashfa Mersey fi Devonport, Tasmania. Wa qad ntaqadat 7ukumat al-wilaya wa ba3d al-nuwwab al-fidraliyyin hadha al-3amal bi-i3tibarihi 7ila qabla ijra2 al-intikhabat al-fidraliyya al-lati sa-tuqam fi November/tishrin al-thani."
"Asba7o bari3ana fil bater li enqadh al marda min al ghargharena, wa kadhaleka al 3asbat, wal mashabik al shiryaniyya li mane3 tadaffuq addam."
"Finlanda wijha ra2i3a lil qawarib. tadhumu ""ard al alef bu7ayra"" aydan alaf al juzur fi al bu7ayrat wa fi al arkhbyl assa7ili."
Ta3rudh al-sura al-taliya al-dharra al-lati tanba3eth menha fotonat. Wa mina al-mu2akad anna al-fotonat fil waqe3 asaghar bi khathir min telka al-mawjudah fil sura.
"Fi alwaqti nafsih, kanat alba7riya al almaniya tu7awilu 2iqaf hadhihi al7araka, bi istikhdam ghawwasat U bi shaklin asasy."
Kanat al-7afila mutajihatan ila Six Flags St.Louis fi wilayat Missouri haythu ta3zuf al-firqa amama jamahir ghafira.
Laqad wajada 3alim ala7ya2 albritany Robert Hooke muraba3at saghira fil fillin bi istikhdam mijhar.
Kanat safina mudada lil algham min tiraz Avenger fi tariqiha ila Puerto Princesa fi Palawan.
"Idha kana alhadaf min ziyarat ashakhs ila makan mu3ayan howa atta3aruf 3ala tarikhih wa thaqafatih, fa inna hadha annaw3 min assiya7a yu3raf bi ism assiya7a athaqafiya."
Yarji3u hadha ila anna al kahraba2 al-moutadafiqqah ila al meqbas 7ythama yathbut al juzu2 al ma3daniy min al mesba7 qad tu3ariduka li sadmah kahraba2iyya balighah idha lamasta al-juzu2 al-da5iliy min al meqbas aw al qa3idah al ma3daniyyah lel mesba7 baynama la yazal juzu2 menha fi al meqbas.
Qad yakun istikhdam tatbiqat almla7t 3abra nzam ta7did al mawqe3 al 3alami (GPS) 3ala hawatifikum adhdhakiyya huwa attariqa al ashal wal aktthar mula2ama lil tanaqul 5arej baladika.
"Min al mumkin an takuna aydan tariqatan jayyida li ziyadat al mizaniya lil sama7 bi iqama atwal fi makanin ma, nadharan ila anna al 3adid min al waza2if attatawwu3iyya tuwaffir sakan wa wajbat ta3am wa 3adad qalil mnihum yadfa3una rawatib qalila."
"Talama baqita fi hadhihi al-mintaqa, yumkinuk 3umuman 3ubur al-7udud duna al-murur 3abr niqat taftish muraqabat jawazat assafar marratan 2ukhra."
"Fi 7awali al-sa3a al 11:29, intaqalat al-i7tijajat ila Whitehall, mururan bi-midan Trafaglar 3ala toul Strand, mururan bi-Aldwych waKingsway bi-tijah Holburn, haythu kana 7izib al-mu7afizin ya3qidu muntada arrabi3 fi fondok Grand Connaught Rooms."
"Hiya laysat dhakiyya lil ghaya, lidha yajeb an ya2khud al masar in7irafan tawilan 7awla jibal Transantarctic lil wusul ila al hadaba."
Kama endala3at al-e7tijajat fi Baris wa Sofya fi Bulgharya wa Vilniyus fi Litwanya wa Valetta fi Malta wa Tallinn fi Estonya wa Edinburg wa Glasgo fi Skotlanda.
"Tatasarraf jama3at al-2usud methla qati3 al-dhi2ab aw al-kilab, wal 7ayawanat al 2u5ra tushbeh al 2usud bi shaklin kabir fi sulukiha (wa laken la yashmul al qe6a6 al kabira al 2u5ra), wa aydan takunu moumitah lel ghayah bi nisabti li fara2isiha."
Al-golf hiya lu3ba yastakhdim fiha alla3ibun al3asa li dharb alkurat fi athuqub.
"Yaqa3u hadha al-mujtama3 al-asil fi Howe Sound qubalat Vancouver, wa yumkinu al-wusul ilayh bi-suhula 3abra sayarat al-2ujra al-ma2iya al-mujadwala allaty tughadir jazirat Granville fi wasat madinat Vancouver."
"Wa ma3a dhalik, fa 2inna jami3 al-kazinuhat al-madhkura a3lah taqriban tuqaddim al-mashrubat, wa al-3adid minha yajlib attarfih alladhy ya7mil 3alama tijariya (bi-shaklin asasy al-kazinuhat al-kabira allaty tu7it mubasharatan bi-Albuquerque wa Santa Fe)."
Tashtarit al Ecuador 2an yatalaqqa al-muwatinun al-Cubiyun khitab da3wa qabla dukhul aradiha 3abra al-matarat adduwaliya aw niqat addukhul al-7ududiya.
"Idha lam takun mu3tadan 3ala al-qiyada 3ala atturuq arrifiya, fa 7afidh 3ala tarkizik: tasudu fihi al-mun7adarat al-7adda wal mamarrat wal mun7anayat adhayiqa."
Tammat mu3alajetuhu 3ala 2al fawr min qebal 2al taqem 2al tobbe 2al mutanaqqel wa tamma naqluhu 2ela mustashfa ma7alli 7aythu tuwuffiyya la7iqan.
La yu3raf wujuduha illa bi-sabab 2athariha 3ala tawassu3 al-kawn.
Sajjala hadafayen wa sahama fi hadafayen akharayan daminan al-fawz li fariqihi Washington bi 5 ahdaf muqabel 3 doda fariq Atlanta Thrashers.
"Kana tabi3uhu raqm 1000 al 3adhim wa ladhi yujassid law7at ""al a3mal al3azima lil muluk alsuwidiyin"" al-lati rasmaha David Klöcker Ehrenstrahl fi 3am 2000, wa al-mudraja fi mawsu3at Guinness lil arqam al-qiyasiya."
"Tadhakkar 2annahu 3ala arraghm min 2anna al-musiqa fil masari7 arra2isiya qad 2intaha 3ardhuha, fa-qad takunu hunaka aqsam mina al-mahrajan satastamirru fi tashghil al-musiqa 7atta waqtin muta2akhir mina allayl."
Yu3addu addukhul ila janub ifriqya bi-ssayara tariqatan ra2i3a li mushahadat jamal al-mintaqa bil kamil wa kadhalika lil wusul ila amakin ba3ida 3an atturuq assiya7iya al-3adiya.
"Illa anna mu3addal al XDR-TB la yazalu munkhafidan lada al-ashkhas al-musabin bi marad as-sil, idh usiba 6 alaf shakhsan min asl 330 alf shakhes fi janub Afriqya 7atta al-la7dha."
"Innaha thuluj madghuta ma3a shuquq mamlu2a wa mu3allama bil a3lam. Wa la yumkin assafaru ilayha illa bi wasitat al jarrarat al mutakhassisa, wa sa7eb azzallajat bil wuqud wal imdadat."
Waba3d thalik bibi'93 sanawat fy 3am 1639 la7'6a 3alim falak englyzy yud3a Ermya Hwrwks 3ubwr kawkab Al-zuhra.
Kul matjar mawjud fil zawiya mali2 bi majmu3a mu7ayyira min bitaqat al itisal al madfu3a musbaqan al lati yumkin istikhdamuha min al hawatif al 3umumiyya aw al hawatif al 3adiyya.
Ya2mal al-mu7tajjun fi jam3 3arida min 1.2 malyon tawqi3 li taqdimiha ila al-kongres al-watani fi November/tishrin al-thani.
"Kama la yajid ay mutatallibat tata3llaq bi 7usulika 3ala raqam ma7alliy min al mujtama3 al ladhi ta3ishu fih, wa yumkinuka al ettisal bil internet 3abra al aqmar assina3iyya fi barari mintaqat Chicken fi Aalaska, aw ikhtiyar raqam yusarri7 bi annaka fi Arizona al mushmisa."
"Ghaliban ma yushar  ela hadhihi al-hidhab bi isim ""vidde"" mimma ya3ni masa7a wasi3a wa maftou7a bila ashjar, wa masa7a la 7udud laha."
"3indama tusafir, la tatawaqqa3 2an takuna al2umur ""kama hiya fi watanik"". Takhtalif al-2adab, wal qawa3id, wal at3ima wal murur, wa ssakan, wal ma3ayir, wal lugha wa ghayriha ila 7addin ma 3an al-makan alladhi taqtun fihi."
Qaddim aydhan nuskhantan min assiyasat/jihat al-itisal li-rifaq assafar wa al-aqarib aw al-asdiqa2 3ala isti3dad lil-musa3ada.
kullama kana raqam Rossby asghar kana al-najem aqal nashatan fi ma yata3allaq bil-in3ikasat al-maghnatisiyya.
Qaddama al-mughanun al-mashhurun min kul an7a2 al-bilad aghani al-bhajan aw al-aghani al-ta3abudiyya li Shri Shyam.
Wa sayasma7u lahu dhalika bi-an yakuna mutwafiqan ma3a kullen min 802.11a wa 802.11b wa 802.11g bi-sharit an ta7tawi al-ma7atta al-asasiyya 3ala ajhizat radio muzdawija.
"Tuntiju an-nabatat al-oksijen al-ladhi yastanshiquhu al-insan, wa ta2khudh thany oksid al-karbon al-ladhi yukhrijuhu al-insan (ay az-zafir)."
"Al-ma3radh al-3alamy (al-ma3ruf bi-ism al-ma3radh al-3alamy, aw bi-basata al-ma3radh) huwa mahrajan dawly kabir lil funun wal 3ulum."
Tu3addu Sirena m7attat al7irasa al-wa7ida allaty tuqaddimu assakan fi salat nawm mushtaraka wa wajabat sakhina bil-2idhafa ila attakhyim. la tuqaddimu qura La Leona wa San Pedrillo wa Los Patos siwa attakhyim bidun khidmat ta3am.
"7inama tatasel bi sha5sen ma 3ala bu3ed alaf al-amyal, fa anta tasta5dem qamaran sina3iyan."
"Nadharan li majmu3at al juzur al mawjuda fil Yaban, ghaliban ma yushar ila al Yaban, min manzdhur jughrafiy, bi esm ""Arkhabil""."
"Tajdhib alsiya7a alqa2ima 3ala attabi3a al ashkhas almuhtamin bi ziyarat almanatiq attabi3iya bi gharad al istimta3 bil manazir attabi3iya, bima fi dhalik al7ayat albirriya annabatiya wal 7ayawaniya."
"Takhtalif siyasat al-ilgha2, wa lakin i3tibaran min awakhir Mars, la tamtaddu mu3dham siyasat al-ilgha2 al-mustanida 3ala virus Corona 7atta Yulyu 2020, 3indama tamma ta7did maw3id al-al3ab al-olimpiya."
Wamunthu thalik al-7in fa8ad sharak al-barazyly fy 53 mubaratin linnady fy jamy3 al-musaba8at wa 2a7raz 24 hdafan.
"Hadha ya3ni annahu yumkinuka ziyarat al madina attarikhiyya li bid3at ayyam kamila, min thamma al 3awda lil nawm 3ala maten assafina laylan."
"Al 3adid min al tansiqat al sha2i3a (3ala sabil al mithal, majmu3at tansiqat APS) tusawi aw taqtareb min nesbat al 3ard ila al ertifa3 hadhihi."
"Attasjil shart idhafy li-3amaliyat al-7usul 3ala atta2shira. fi ba3dh al-buldan, yajibu 3alayka tasjil 7udhurik wa 3unwanuk 7aythu tuqim lada assulutat al-ma7aliya."
"Athna2 alkifa7 min 2ajl al-istiqlal alladhy nadhamathu 7arakat Mau, 2adda tajammu3 silmy fil madina ila maqtal za3im al-qabila al-a3la Tupua Tamasese Lealofi athalith."
Wa adda i3lan al-yawm ila tamdid iltizam al-7ukuma al-ladhi ta3ahadathu fi Maris/adhar hadhihi al-sana li tamwil 3arabat al-itfa2.
"Idha kana ladayka waqt safar idafi, fa ta7aqaq min muqaranat assi3r al ijmali li Afriqya bil si3r 7awla al3alam."
Laqd da5al Juni Riid al-qa2id al-musharik lifariq a1 nyuziland at-tari5 al-ywm min 5ilal qiyadatih al-asra3 3ala jisr marfa2 2awkland binyuzilnda al-lathy yablu'3 min al-3umr 48 3aman bishkl qanuni.
Ya3mal mi3yar 802.11n 3ala kulen min taraddudat 2.4 Gega hetrz wa 5.0 Gega hetrz.
"A5faqa sila7 Uka bynama kana musawabban 3ala ra2isi rajoulen 5amsiniy. Wa yu3ani Schneider men alamin mutawaselin, wa 3ama fi  2e7da 3aynayh, kama faqada juz2an men jumjumatihi, wa 2u3ida bina2u wajhihi min al-titaniyom."
"Tadom al Yaban ma yuqarib 7000 jazira (akbaraha jazirat Honshu), memma yaj3al al Yaban sabe3 akbar jazira fil 3alam!"
"Tu3rad al mashahid 3ala al ahramat, wa tuda2 jami3 al ihramat al ukhra."
Wa 2ashara ila anna ba3d al dirasat tushir ela anna al-marad yajeb 2an yusbi7a aqal fatkan qabla 2an yatasabbaba fi waba2en 3alamiyyin.
"Yu3addu al 3aysh wa ttatawwu3 fi baladin ajanabiy tariqa ra2i3a lil ta3arruf 3ala thaqafa mukhtalifa, wal iltiqa2 bi askhkhas judud, wa ktishaf nafsika, wa ta3llum i7tiram wujhat annadhar, wa ktisab maharat jadida."
"Tamma ilqa2 al-lawm 3ala quwat 7afidh al-salam wa lati wasalat ila Haiti ba3da zilzal 3am 2010, fi tafashi al-marad al-ladhi bada2a min mu3askar hadhihi al-quwwat."
"Tamma rafe3 al-da3wa fi wilayat Virginia li2annaho mawten sharikat AOL al-ra2ida fi taqdim khadamat al-internet, bi 2e3tibariha al-sharika al lati 7arradhat 3ala al-itihamat."
"Fi jami3 an7a2 al-madina alqadima, min assahl al-3uthur 3ala amakin tabi3 assila3 al-maghribiya attaqlidiya, mithl attawajin wa al-fakhar wa assila3 al-jildiya wa ashisha wa majmu3a kamila min al-ashya2 attafiha, wa lakin kul dhalika li ssuya7."
Fil waqet al 7ader nadiran ma yatim 7ajez assafar al jawwi mubasharatan 3abra shirkat attayaran min dun al ba7eth awwalan 3an al as3ar wa muqaranatiha.
"Fi dhel mana5 al sharq al awsat al dafe2,lam yumathel al manzel ahamiya balighah."
Bada2 al-mughany Sangu Sharma fi al-masa2 yaleihi Gay Shankar Tshudary. kama 9a3ad Tshaban Bhwg Bhagan ay'9an. la8ad kan yurafi8hu al-mughany Ragw Khandlwal.
Istakhdamat hadhihi altelescopat 3adastayn mudmajatayn kay taj3l al-ashya2 alba3ida tabdu aqrab wa akbara 7ajman.
"Tu3addu dawlat Madagascar akbar al-buldan bila munazi3, wa hiya bi-mathabat qarra bi-mufradiha 3indama yata3allaqu al-2amr bil 7ayat al-barriya."
Yumkinu 2an tashmal al-a7dath assi7ya al-mu7tamala 3ala al-mada al-ba3id min al-ifrat fi shurb al-ku7ul talaf al-kadib wa 7atta fuqdan al-basar wal wafat. yazdadu al-khatar al-mu7tamal 3inda istihlak al-ku7uliyat al-muntajat bi-shaklin ghyr qanuny.
Yakhtalif isti3dad al-7ukuma li isdar jawazat safar ma3 3adam ta7did al-jinis (X) aw ta7dith al-mustanadat li tatanasab ma3a al-isim al marghub wal jinis.
"Kana fakkaha al-6awilan murassa3an bi akthar min 70 sennan 7addan kal shafrat, bel idhafa ila majmou3a idhafiyya min al asnan tujad fi al juzu2 al 3ulwiy min famiha, memma ya3ni annahu la yujad mahrab li ay shay2 yaqta3 tariqaha."
"Law fashila al7ulafa2, fa rubbama kanat almanya qadiratan 3ala ghazw Britanya kama fa3alat m3a baqiyyat Orobba."
La8ad tabi3atha 2urkistra al-dawlat al-symfwnya fy Is6nbwl wahiya fir8at Enkishariya walmughanniyan Fati7 Erkwatsh wa Muslwm Ghwrsys.
"Jumhuriyat ad-Dominican (bil-espaniya: República Dominicana) hiya dawla karibiya tasghal annisf asharqi min jazirat Hispaniola, wa allaty tatashـaraku fiha ma3a Haiti."
"Yajri tandhim al-3adid min arra7alat ila ashu3ab al-murjaniya 3ala madar al-3am, wa nadiran ma ta7duth isabat li-ayi sabab min hadhihi al-asbab 3ala ashu3ab al-murjaniya."
"Idha waqa3a al-faris min 3ala al-7isan wa 3aliqat qadamuhu fi arrikab, fa-qad yatimmu jarruhu idha haraba al-7isan ba3idan. Li taqlil hadhihi al-makhatir, yumkinu itikhadh 3adad min i7tiyatat assalama."
"Tamaththala al mafhum fi anna jami3 adduwal al-Orobbiya 3alayha as-sa3iy na7wa mane3 dawla wa7idah min an tosbe7 qawiyyah, wa 3ala hadha ghaliban ma kant al 7ukumah al wataniyyah tughayyir ta7alufatiha min ajel al 7ifadh 3ala  attawazun."
"kana hadha ashbah bil 7alat al-arba3 lil mada (bi ttartib zatih): assalba wa ssa2ila wal ghaziya, wal plazma, wa dhalika 3ala arraghm min annahu iftaradha kazalika annaha tata7awwal ila mwad jadida takhtalifu 3amma narah."
La7za al-ba7ithun wujud bilawrat fi bawl al-hirra 3inda idafat al-milanin wa 7umd al-siyanik.
"Wa ma3a dhalik, yujad fil waqt al-7adhir rassamu algraffiti, wa fa3aliyat al-kitaba 3ala al-judran wal judran ""ashar3iya"". Ghaliban ma tushbih law7at al-kitaba 3ala al-judran fi hadha assiyaq al-a3mal al-faniya badalan min al-3alamat ghayr al-maqru2a."
"Yujad al-3adid min anwa3 al-mashrub al-faransy, lakin anwa3 al-mashrub al-newzilandy wal 2usturaly yumkin naqluhuma ila al-kharij bi-shaklin afdhal."
Tatadamman al-qimam manadhir khallaba mina al-qimma. Yunshi2 al-mutasalliqun min jami3 an7a2 al-3alam bi-istimrar turuq jadida bayna qudurat al-judran ghayr al-ma7duda.
Wa badat janub afriqya hashatan amama shaqiqatihi al-janubiyyat illa annahu sur3ana ma 7asanat min ada2iha ma3 taqaddum al-butula.
"I7tadam al-jadal natijatan lil2i5tilaf 7awl al-infaq 3ala al-i'3atha wa i3adat al-i3mar fi a38ab 7uduth i39ar Katrina. ith a6laqa 3alayha ba3'9 al-m7afzin al-malyin bi6ari8a sa5ira ism ""9fqat bush fi Nyw Awrlyanz."""
"Yatadamman atta3rif tanawwu3at jughrafiya muta3addida, wa qad yakun al-mada al-3omry aqsar fi amakin mithl Amrika ashamaliya minhu fi Europa."
"Bi-raghem min woujoud leqa7en qadiren 3ala al-7ad min wafiyyat marad al-Ebola, illa anna 7atta l2an, lam yatem ithbat ay 3aqarir munasiba li 3ilaj al-3adwah al-mawjoudah."
"Wa wasafa al-muta7adith bi-ism Bush, Gordon Johndroe, ta3ahud kuriya al-shamaliyya bi anahu ""khutwa ra2isiyya na7wa hadaf ta7qiq naze3 al-sila7 al-nawawi fi shibih al-jazira al-kuriyya bi shakl yumkin al-ta7aquq minhu."
"Istadama al-qamaran al-sina3iyyan, al-ladhan yazinu kul minhuma akthar min alf ratel wal mutajihan bi sur3at 17,500 alf mil bi-sa3a taqriban, 3ala itrifa3 491 milan fawqa al-ared."
Yaqul al-3ulama2 inna hadha al-infijar al-najem 3an al-istidam kana infijaran ha2ilan.
Yadhhab ad-dam ba3idan 3an al-qalb fi anabib tusamma al sharayin wa ya3ud ila al qaleb fi anabib tusamma al awrida. Asghar al anabib tusamma al shu3ayrat al damawiyya.
Yajry al-i7tifal bi-mu3dham al-a3yad fil ma3bad ka-juz2 min dhikra al-ma3bad aw 3id milad al-2ilah aw ayi 7adath kabir akhar murtabit bil-ma3bad.
"Ka wilaya ta7sul 3ala kul shay2, mana7at Florida jami3 mumathiliha al-5amsin li Romney, memma dafa3ahu ila al-amam bi i3tibarihi al-murasha7 al-awal lil 7ezb al-jumhuri."
Lil3awda ela mustawa al-6a8a al-sabi8 lahum yajib an yatakhalla9u min al-6a8a al-2i'9afiya allaty 7a9alu 3alayha min al-'9aw2.
"Idha kunta tusafir ma3a jihaz computer ma7mul aw jihaz law7y, fa qum bi-takhzin nuskha fi dhakiratih aw qursih (yumkinu al-wusul ilayha bidun internet)."
Lam tarid anba2 3an wu8u3 e9abat kha6yratan lakin kan hunak khamsatu ashkha9 3ala al-2a8al fy al-maw8i3 wa8ta al-2infjar 8ad 3ulijw min a3ra'9 al-9adma.
"3ala assa3id addawly, hunaka ma yaqrub min 200 munadhama siya7iya mustamirra fil 3amal. ya3mal mu3dhamuhum bi-shaklin mustaqil."
"Wa adafa Stofan:""Bi-qadri ma na3lamahu, hunaka jisim kawkabi wa7id faqat ya3ridu dinimakiyya akthar min Titan, wa ismuhu Kawkab al-Ared""."
"Tu3tabar 3anasir mithl alcalcium wa alpotassium ma3adin. Bi ttab3, hunaka aydan ma3adin mithla alfidha wa dhahb."
