"Ta7taden 2al be7ar turkeya min thalath jehat: ba7r 2eje min 2al gharb, 2al ba7r 2al 2aswad min 2al shamal, wal ba7er 2al mutawasset min 2al janub."
"Thumma yatimmu taqdim qa2ima bil-mudhifin al-muta7in 2imma matbu3a wa/aw 3abra al-internet, a7yanan ma3a al-muraji3 wal ta3liqat min qibal al-musafirin al-akharin."
Ytadmman al-ba7th fi dhaka2 al-istina3y sun3 al-2alat li atmatat al-maham allati tatattallab sulukan dhakiyyan.
Mu3dham anwa3 al-boomerang al-mutawaffira fi 2ustralya la ta3ud ila ramiha marra 2ukhra. mina al-afdhal lil-mubtadi2in 3adam mu7awalat arramy fi mahab arriya7
Wa taqulu hadhihi al-nazariyya inna mu3dham al-madda al-mudhlima 7awla allmajarra tatamarkadhu 3ala shakli hala wa tatakawwanu min jusaymatin saghira.
"Tamma al-iblagh 3an aqal min alef 7ala bayna al-bashar, lakin b3dhaha kana qatilan."
Tuwufiya la3eb al-judoka al-yabani Hitoshi Saito al-fa2ez bi midaliyatayn dhahabiyatayn olombiyatayn 3an 54 3aman.
"Yujad fil quds al-3adid min al-mawaqi3 attarikhiya wal athariya wa thaqafiya, bil-idhafa ila marakiz attasawwuq wal maqahy wal mata3im al-7ayawiya wal muzda7ima."
"Fil asas, tanqasim ila fi2atayn: imma al-3amal athna2 assafar aw mu7awalat al-7ad min nafaqatik. turakkiz hadhihi al-maqala 3ala hadha al-akhir."
Laqad kana mina alma3arif munzu fatra tawila anna hunaka anwa3 mukhtalifa min talaf almukh wa assadmat wal 2afat wal awram tu2athiru 3ala assuluk wa tusabbib taghayurat fi b3dh alwza2if al3aqliya.
Ghaliban ma takunu ashawati2 wal muntazahat wa almukhayamat hiya al amakin al akthar shuyu3an allaty yartaduha alsuya7 alladhyna ya2tuna min ajl attarfih.
Yajib an yakuna muwaffir al hatif al ma7alli qadiran 3ala tazwidika bil ma3lumat 3an ittisalika bi hadhihi al khidma.
Yumkinu insha2 rusum muta7arikka mutatawwira 3ala ajhizt alcomputer wa yustakhdam hadha annaw3 mina arrusum almuta7arika bi shaklin mutazayid fi attelevision wal aflam.
Wa yabqa Keselowski mutusadiran fi al-butula bi rasid 2250 noqta ba3d assibaq.
La8ad 2dda al-sayd Martyly ams al-yamyn amam majlis intikhaby mu2a8at jadyd (CEP) mukawanan min tis3ati a3'9a2.
"Wa min na7iya 2ukhra, tu3tabar adhuruf al-jalidiya wa athaljiya tabi3iya fil 3adid mina al-buldan, wa tastamirru 7arakat al-murur fil ghalib duna inqita3 3ala madar assana."
"Yutleq al-3ulama2 3ala hadhihi al-3amaliyyah esim""al enbi3ath al-musta7ath lel esh3a3"" nadharan li anna al-daw2 al sate3 ya7for al-dharah, memma yatasabab fi enbi3ath foton men al dhaw2, wal dhaw2 huwa naw3 min al-esh3a3."
Tamma taghyir al-qanun al-Faransi. Wa ta3udu nash2atuhu ila sin al 15 3indama endamma ila al-muqawama al-Faransiyya 5ilala al-7arb al-3alamiyya al-thaniya.
Asba7at hadhihi mushkilah aqal idh yafi musani3u al 3adasat bi ma3ayir a3la fi entaj al 3adasat.
Wa kanat al-tamrira al-7asima al-ula fi muabarat al-layla min Ovechkin hiya hadaf al-fawz al-ladhi sajalahu Nicklas Backstrom;
Yushir al3ilm al2an ila 2anna hadha al-iqtisad alha2il min alcarbon qad aza7a almu7it al7ayawiya min i7da 7alatih almustaqira allaty da3amat attatawur albashariya khilal almilyunay sana almadhiya.
Wa sayltaqi al-fariqan fi al-nisif al-niha2i al-kabir idh tafawwaqa Noosa 3ala al-fa2izin bi fariq 11 noqta.
"3ala arrughum min annaka qad ta3taqidu annahu min assahl al indimam ila sharikat attayaran al-lati tusafir ma3aha kathyran, yajib an tudrik anna al imtiyazat al muqaddama ghaliban ma takun mukhtalifa wa anna niqat al musafir adda2im qad takunu akthar skha2an fi dhil sharikat tayaran mukhtalifa fi nafs atta7aluf."
"Tashmalu sharikat e66ayaran allati tuqadim hadha: Al-khutut Al-jawiyya Al-kanadiyya, wa khutut Delta al-jawiyya, wa Lufthansa lil ra7lat al-qadima min Al-Wilayat Al-muta7ida aw Kanada, wa WestJet."
Qamat al-muraqaba al-ardiya Al-Russiya bi tanshit atta2irat wa esti3adat al-wad3 a66abi3i lel ma7a66a.
Inna qarar al-sayed Rudd bi-tawqi3 3ala itifaq Kyoto lil munakh ya3zilu al-wilayat al-muta7ida li tusbi7a bi-dhalika al-dawla al-mutaqadima al-wa7ida al-lati lan tusaddiq 3ala hadhihi al-ittifaqiyya.
Yantaqid at-tqrir biquwwa kul janib taqriban min jawanib as-siyasa al-7aliyya lissul6a at-tanfithiyya fi at-ta3amul ma3 al-3iraq kma ya7uth 3ala i7dath ta'3yir fawry fi tawajjuhiha.
"Limadha tansha2 anzimat annaql mithla hadhihi ashakawa, wa limadha tafshal bi shakl yawmi? hal muhandisu annaql ghayr akiffa2? 2am anna hunaka shay2an akthar jawhariya ya7duth?"
Kama ashada almusari3un alzumala2 bi Luna.
7adatha nashat al-zelzal al-dha5em al-ladhi adda ila taghyir al-mar7ala bi tari5 10 Maris/Adhar 3ala al-janeb al-shamali mon qemat burkan Kaldera.
Tushiru attaqarir al-awwaliya ila ta7awul masar atta2ira ila Afghanistan ba3da an muni3at min al-hubut adtirari fi Urumqi.
"Ba3da a7dath yawm al-arbi3a2, tanafasat Karpanedo fi sibaqayn fardiyayn fi al-butula."
Tu3addu San Francisco aydhan a7ad afdhal al-amakin fil balad bi nnisba lil ma2kulat al-asyawiya al-2ukhra: al-kuriya wal taylandiya wal hindiya wal yabaniya.
Wa8al Ludin ay'9an enna al-ms2ulin 8rraru el'3a2 jawlti al-e3ada li en8ath al-af'3an mn anfa8at walmakha6ir al-amniya li ejra2 entikhabat ukhra.
Kana mena lmoumken an tastakhdimaha al-Triceratops menqaraha al-qawiy li naz3 al awraq qabla akel al jidh3.
"Tamil ba3dh al-7ayawanat, mithil al-fiyala wa zzrafat, ila al-iqtirab min assayarat 3an kathab, wa tasma7 al-mu3iddat al-qiyasiya bi-rru2ya al-jayida."
"Fi 7in annka qad la ta7taj ela ta2shira lil ziyarat al qasira ila ba3i9 adduwal ka sa2i7 aw lil 3amal, fa enna adhdhahab ila hunaka ka talib duwali 3ammatan yatatallab iqama tawila akthar min dhahabika ka sa2i7 3adiy."
2uqila Piquet Jr. ba3da ja2izat al-majar al-kubra 3am 2009.
"A3lana yawm al-ithnayn, 3ulama2 min kulliyat al-tib bi-jami3at Stanford, 3an i5tira3 adat tash5isiyya jadida yumkinuha farez al-5alaya 7asab annaw3: w hiya 3ibara 3an shari7a sa8ira qabila lil tiba3a yumkinu tasni3aha bisti5dam tabi3at 7ibriyya muqabel 7awali sant amriki li-kollen minha."
"Taraja3at quwwat Felicia , al-lati kanat 3asifatan min fi2at 4 bi-7asabi miqyas SaffirSimpson lil a3asir, li tasil ila munkhafad istiwa2i wa tatabaddad tamamn yawm al-thulatha2."
"idha kunta tash3ur bi mazid min almughamara, fa ightanim alfursa li 3amal 3asir aw khalt al3asa2ir:"
Ma3aridh zira3at al-basatin addawliya hiya fa3aliya mutakhassisa tusallit adhaw2 3ala 3urudh al-azhar wal 7ada2iq annabatiya wa ayu shay2in akhar yata3allaq bi-nnabatat.
"Nu2ases buyutana min an-nabatat, wa kadhalika nasna3 mlabisana min an-nabatat. Aghlab al-a63imah al-lati natanawaluha min an-nabatat. Wa la yumkin lel 7ayawanat al-baqa2 3ala qayd al 7ayat min doun an-nabatat."
Wa kanat al-amtar mas7uba bi-3awasif ra3diyya wa bareq mutakarir.
"Za2ir al nemer la yushbihu za2ir al asad bl dhabet, wa lakennahu ashbah bi jumla tadom 3ibarat zamjara wa siya7."
"La8ad kanat al-mubaratu anniha2ya lifary8 ""Awl Blaks"" alathy faz bilfi3l billa8ab month 2osbw3ayn."
Tashtaret al 3adeed min al 7ukumat 3ala azzuwar al-ladhin yadkhulun buldanaham aw al-muqimin al-mughadirin an yatalaqqaw luqa7at al 3adid min al-amrad.
"Satu7aqqiq Stardust raqaman qiyasiyyan jadidan li kawniha asra3 markaba fada2iyya ta3udu ila al-ared, mu7atimatan bi-dhalika al-raqam al-qiyasiy al-sabiq al-musajal fi Mayo/ayyar 1969 athna2 3awdaw wi7dat qiyadat Apollo X."
"Zira3at al kafaf hiyi 3ibara 3an nidham basit, wa ghaliban ma yakun 3udwiy, yasta5dem al budhur al ma7fuza al asliyya fil manateq al bi2iyya bil idafa ila tanawub al ma7asil aw ghayriha min attiqaniyat al basita nesbiyya li ziyadat al ma7sul."
Kan al-athr al-lathi bat yab7athu 3anh al-fariq najman 3an quwwat mad bayn al-madda al-mu3tima fi al-majrra wal-madda al-mu3tima fi majarrat darb at-tabbana.
Yu3addu nahr al-Amazon aydan aws3 nahr 3ala wajh al-ard 7aythu yablugh 3arduhu sittat amyal fi b3d al-a7yan.
kan min al-mujma3 an ta8wm fir8at arruk bijawltin fi Al-wilayat Al-mutta7ida wa Kanada 7ata 16 Sibtimbar.
"2akhiran, hunaka al 3adid men al qi6a6 al saghira (bi ma fi dhalika al qi6a6 al alifa al taliqa) al lati ta2kul al fara2es al saghira al akthar 3adadan mithla al 7asharat wal qawaredh wal 6uyur."
La8ad 7awalat riya'9at al-askwash walkaratyh wariya'9t attazaluj addukhul ela al-barnamij al-owlamby wakathalik al-baysbwl walkra allayina allaty jara atta9wyt 3alayha kharij al-al3ab al-owlambiya 3am 2005.
"Wulida Bobek fi al-e3simaa Al-kroatiya Zaghreb, wa iktasaba shuhratan athna2 la3ibih ma3a Partizan Belgrade."
Faza 7akim wilayat Massachusetts alssabiq Mitt Romney fi al-enti5abat al-tamhidiya arri2asiyya lil 7ezb al-jumhuri fi Florida yawm al-thulatha2 bi akthar min 46 bil me2a mena al-aswat.
"Yamtad toul 2al 2aradi 2al Turkiyya 2ela 2akthar min 1600 kilometer (1000 mil), baynama yamtad 3ardhuha ela 800 kilometer (500 mil) wa huwa ma yaj3aluha ta2khudh shakel 2al mosta6il."
Goma madina siya7iya fi jumhuriyat Congo addimuqratiya fi aqsa asharq bil qurb min Rwanda.
"Yakunu almusharikun fi nashat muntazam bi 7ajatin ila mazid mina adda3m 3indma yt3laq al2amr bi alnazarat alsilbiya lil 2alam, allathy yumayiz al-ikhtilafat bayna al-2alam almuzmin wa ashu3ur bi 3adam arra7a natijatan lil 7arakat albadaniya al-i3tiyadiya."
"3ala arraghm min kawniha asghar 7ajman, fa hiya tudhakkir ba3dh kibar assin azza2irin laha bi-Hawaii qabla istiqlaliha, wa kayfa kanat duna kul al-fanadiq assiya7iya al-kabira wa ghayriha mina attatawwurat."
"Yatimmu la3ib thmaniyata 3ashar 7ufra khilal aljawla al3adiya, 7aythu yabda2 alla3ibun 3adatan min awwali 7ufra fil mal3ab wa yantahun fi athamina 3ashar."
Jazirat Bowen hiya ri7la nahariya shahira aw ri7lat 3utlat nihayat al-2usbu3 tuqaddim attajdif bil-kayak wal-mashy li-masafat tawila wal matajir wal mata3im wa akthar min dhalik.
"3ala sabil al mithal, tansiq al taswir al futugrafi al akthar shuyu3an lil suwar al thabita fil 3alam huwa 35 mm, wa huwa al 7ajm al muhaymen lil film fi nihayat 3asr al film al tamathuliy."
"Kama howa al 7al ma3a mashakil al jihaz attanaffusi fi almanakhat al barida, fa inna al mashakil al ma3awiyya fi al manakhat al 7arra sha2i3atan ila 7addin ma wa fi mu3dham al 7alat takunu muz3ijatan bi shakl wadi7 wa lakinnaha laysat khatiratan 7aqqan."
Ikhtafa 8abla 7awali 3ashr da8a2i8 min wu9ulihi ila al2ar'9 min i8tirabihi althani.
Ash-shaks al ladhi yazen 200 ra6el (90 kg) 3ala al ard yazinu 7awalay 36 ri6lan (16 kg) 3ala kawkab akhar lidha fa inna al jadhibiyya bil 6abe3 la tashudduka kathiran.
Estab3adat siyasat Komen markaz tandhim al-2usra bi sabab al-ta7qiq al-mu3allaq 7awla kayfiyat enfaq markaz tandhim al-2usra wal iblagh 3an amwalih al-lati yudiruha al-mumathil Cliff Stearns.
Yumkin an takun al-mamarrat al-ma22iya al-dakhiliyya mawdu3an jayidan li iqamat 3u6la 7awliha.
Ya3mal al-3ulama2 3ala ensha2 mafa3el yumkunha entaj al-taqa bi nafs al-tariqa.
"Iktashafa Curtis Cooper, 3alem al-riyadhiyyat wa ustadh 3ulum al-7asub fi jami3at Central Missouri, akbar 3adad awwaly ma3ruf 7atta al-2an fi 25 kanoun al-thani."
"Europa qarra saghira nisbiyan wa lakin biha al-3adid min adduwal al-mustaqilla. fi dhil adhuruf al-3adiya, qad ya3ni assafar 3abra buldan muta3addida al-idhtirar ila al-murur bi-talabat atta2shira wa muraqabat al-jawazat 3iddat marrat."
"Tarbitu qanat al ba7er al Abyad wal Baltiq bayna al mu7it al mutajammid ashamali wa ba7er al baltiq 3abra bu7ayrat Onega, wa Ladoga wa Saint Petesburg, wa yatimmu dhalika ghaliban 3an tariq al anhur wal bu7ayrat."
"Wa qal muta7adithun bi-isim al-7ukuma:""Innahu min al-daruriy al-yawm min mandhur al-se77a al-3amma wal 3adala al-jina2iya an yatimma san attashri3 bi-aqrab waqtin mumkin""."
Satushiyr al-wathi8a -wif8a littasryb- ela al-khilaf al-7udwdy allathy tastakhdimuhu Falas6yn 2istinadan ela 7udwd ma 8abl 7arb 1967.
Adharat saghira jidan li darajat anna trilyunat minha yumkin 2an tatanasab m3a annoqta almawjuda fi nihayat hadhihi aljumla.
"Laqad alghat al-firqa 3ardaha fi mal3ab al-7arb al-tidhkari fi Maui, wa ladhi kana min al-muqarrar an ya7duruhu 9000 shakhsan. Wa qad qaddamat al-firqa i3tidhariha lil jamahir."
Wa qad khasira mu2akharan amama Raonic fi iftita7iyat Brisbane.
"Idtirab nuqs al intibah ""howa mutalazima 3asabiya laha thaluth taqlidi min al a3rad bima fi dhalika al indifa3, wa altashtut, wa fart alnashat aw alttaqa alza2ida""."
"Fi 7alat 3ubur ba7r al-baltiq ashamali fi ashita2, ta7aqaq min mawqi3 al-kabina, 7aythu 2anna al-murur 3abra al-jalid yusabbibu dhawdha2 murawwi3a lil-ashkhas al-akthar tadharruran."
Yatimmu istikhdam al-3adid min attadhakir allaty yatimmu bay3uha 3abra al-internet min khilal mawaqi3 al-mazadat mithl eBay aw Craigslist juz2iyan ka tadhakir Park-hopper muta3addidat al-ayam.
Istamarra al-3adid min kuttabihim fi fared ta2thir 3adhim 3ala 3urud Jon Stewart wa Stephen Colbert.
Fa8ada Giankarlu Fisitshella al-9ay6ara 3ala sayaratih wa intaha assiba8 ba3da wa8t 8asir min al-bidaya.
Yakhruj Stywart wa Jwrdan wa Kynsyth wa Harfyk min al-marakiz al-3ashra al-awa2il fy bu6wlati al-3alam lilfwramil ma3 ba8a2 arba3ati siba8at fy al-mawsim.
"Wa yashghal Sundarbans misa7at 3850 kilometr muraba3, tughati al-miyah/al-mustanqa3at thuluthaha taqriban."
"Laqad kanat madinat Smyrna al qadimat taqa3 7awla khalij dakhem wa mu7ita bil jinal, amma al yawm fa hiya haditha wa mutatiwwira jiddan wa markaz tijariyy muzda7im."
"7asala 3ard PBS 3ala akthar min 3ishrin ja2izat Emmy, wa kanat muddat 3arduhu aqal min Sesame Street wa Mister Roger's Neighborhood."
"Hunaka 3adad min al-mata3im al-mu7ita bil-7adiqa, wa khilal fatrat ma b3d adhahira wa fil masa2 ghaliban ma tuqamu 7afalat musiqiya majjaniya min al-maqsura al-markaziya lil-7adiqa."
"Yumkin 2an takuna assaqalat iftiradiyyatan wa 7aqiqiyyatan 3ala 7addin sawa2, wa bi 3ibaratin 2ukhra, almu3alim howa shaklun min ashkal alsaqalat, wa kadhalika al-rajul al-saghir fi Microsoft Office."
"3allaqa Dustin ""Goldust"" Runnels qa2elan :"" Luna kanat gharibat al-atwar mithli… wa rubbama akthar… 2u7ebbuha wa sawfa 2aftaqiduha… 2amal 2an takuna fi makanin afdal."""
Ta7duth al a6war nadharan li2anna janeb kawkab al zuhra (aw al qamar) al muwajeh lel shams huwa al mudha2 faqat. Wa da3amat a6war kawkab al zuhra nadhariyyat Copernicus al lati tanussu 3ala anna al kawakeb tadouru 7awla al shams.
"Kana zamiluhu fi al-fariq Fernando Alonso fi al-sadara li mu3zam al-sibaq, lakinnahu anha al-sibaq mubasharatan ba3da tawaqufihi al-mufaji2,rubbama bi-sabab 3ajalatin amamiyya bi-jihat al-yamin matwiyya bi-shaklen ghayr sa7i7."
La yujad lil shams qeshra methel al ard yumkinuku al wuquf 3alayha. Tatashakal al shams b akmaliha min al ghazat wal nar wal blasma.
"Ta7dha mu3dham al-manatiq bi-khidmat 7afilat Coaster yabaniya saghira, wa allaty tattasim bi-rra7a wal matana."
qad yakunu akthara anwa3 assiya7a shuyu3an ma yarbituhu mu3dham annas bi assafar: assiya7a attarfihiya.
Wa tamakkana al-sayed Reid min qiyadar al-sayyara al-nyouzlandiyya A1GP 3ala al-jiser sabe3 marrat bi-sur3atin tazid 3an 160 kilometer bil sa3a.
"Wa mudhu istiklal al-Bakistan 3an al-7ukum al-Britani, 3ayyana arra2is al-Bakistani ""wukala2 siyasiyyin"" li 7ukum al-manatiq al-qabaliyya FATA, al-ladhin yumarisun saytara shibih kamila 3ala hadhihi al-manatiq."
Wa ta3ni al-3uqubat al-dawliyya al-jadid annahu la yumkinu shira2 tayyarat.
"3ala arrughum min anna ak arkhabilat assahiliyya wa akbar al bu7ayrat kabira bil fi3l bima yakfi li ayyi yakhet, illa anna al qawarib assaghira aw 7atta qawarib al kayak tuqaddimu tajribatan mukhtalifa."
Nuqila al-musawwir ila Markaz Roland Reagan UCLA attubi haythu wafathu al-maniya 3ala al-fawr.
Albrutiniyyat laha shu7nat kahraba2iya mujaba baynama annaytrunat lysa laha shu7nat. Al-iliktrunat laha shu7nat kahraba2iya saliba.
"Wa min al-mutawaqqa3 an tuwaddim al-kabsula 3inda wusuliha ila al-ared wa tadkul al-ghilaf al-jawwi, 3ardan khafifan lil sukkan Califronia wa Oregon wa Nevada wa Yotah fi tamam assa3a al-khamisa fajran (bil tawqit al-sharqi)."
"Bi attab3 yajib 2an yatamata3 al3adda2 min addaraja al 2ula, arrajul alladhi yumkinuh attaghalub 3ala arraqam al-qiyasi almutamathil fi daqiqatayn, bi qadrin la ba2sa bihi min assur3a, wa lakin yajib saql alqudra 3ala atta7amul fi jami3 almakhatir."
"Qad yakun assafar bi tta2ira tajrubatan mukhifa li askhkhs min mokhtalaf al a3mar wal khalfiyyat, la siyyama idha kanu yusafiruna lil marra al oula aw 3ashu sabiqan 7aditha mu2lima."
Kan Al Gore wa al-General Tommy Franks yatasadaran 3anawin al-akhbar al-mufaddala ladayhim (afada maktab The Onion anna Gore marasa huwa wa Tripper afdal 3alaqa jinsiyya fi 7ayatihim ba3da hazimat al-hay2a al-intikhabiyya 3am 2000).
Anfelwanza a66uyur yumkin 2an tusib a66uyur wal thadiyyat.
"Yumkinu li ba3e9 attabiqat fi hadhihi al fi2a tarjamat nsus bil lughat al ajnabiyya 3ala al isharat aw al ashya2 fil 3alam al waqi3iy, 3indama yuwajjihu al mustakhdim jihazahu na7wa hadhihi al ashya2."
Lam yasbeq li 2ay shakhs akhar an dhahara aw sajjala ahdafan lel nadi akthar men Bobek.
"Kashafat addirasat 3an anna al-ikti2ab, wa alkhawf, wa atta3arrudh lil azamat tatawassat al3alaqa bayna al-2alam wa al3ajz, lii ladhina yu3anun min alam asfal adhahr."
Kana lada al jarra7in ma3refa bil 3adid min al muhadde2at bima fi dhalik al morfin min mosta5lasat budhur al 5esh5ash wal skoblamin min budhur al a3shab.
"Min al mumkin tawfir al mal li shira2 5ara2et jadida li nidham GPS, aw jihaz GPS aw isti2jar wa7id min sharikat ta2jir assayarat."
"Bi sabab tarbiyatih 3la yad 7ywanat ba3idan 3ani albashar, fa inna al-tifl al-mutawa7ish yuُzhir sــulukiyat (9umun al7udud aljasadiya) tushbih tmaman sulukiyyat 7ayawanat alri3aya almu3ayana, mithl alkhawf min albashar aw 3adm al-iktirath bihim."
"Fi 3am 1683, saytarat quwat usraty Qing (1644-1912) 3ala al manatiq al sa7iliyya al gharbiyya wa al shamaliya fi Taywan wa a3lanat Taywan ka muqata3a tabi3a li imbratoriyyat Qing fi 3am 1885."
"La8ad wu9if mu3addal hu6wl alam6ar -allthy wa9al ela 6.34 buw9t 3ala mi8yas awahw- 3ala annahu ""mufyd""."
"Wa sata3bur al-kabsula bi-sur3at 8 mil bi-thaniya, wa hiya sur3atun kafiya li yantaqil min San Francisco ila Los Angeles bi-daqiqa wa7ida."
Bal innahu ya8tari7 anna mithl hathihi al8udrat fi tafsir al-suluk al-bashari yumkin 2an tashtarik fiha 7ayawanat mithl al-kilab al-2alifa.
"Tatasharak mo3dham tafserat al 7atmeyya atteknolojiyya fi fekratayn 3ammatayn: anna tatawor atteknolojya nafsaha yatba3 masaran yatajawaz atta2theer aththaqafe wal seyasi ela 7adden kaber, wa tu2athther hadhihi atteknolojya bi dawreha ""ta2aththuran"" 3ala al mujtama3at al mota2assela, badalan min al lati tata2aththar bil mujtama3."
Yumkinu lil murasha7in an yursilu mumathilin li muraqabat sayr al-3amaliya. Wa bi-layl yatim i7sa2 al-aswat min qibal mutatawwi3in wa ta7ta muraqaba mushaddada wa wifqa ijra2at mu7addada.
"Tu3addu mu3dham al-juzur assaghira duwal mustaqilla, aw murtabita bi-Faransa, wa tu3raf bi-ism al-muntaja3at ashati2iya al-fakhira."
Idha kunta tusafir fi dawla namiya li awal mara - aw fi juz2 jadid min al 3alam - fa la tuqallil min sha2n assadma al thaqafiyya al mu7tamala.
Satuqam al-al3ab ashibh olimpiya fil fatra min 24 August ila 5 September 2021. satuqam ba3dh al-fa3aliyat fi mwaqi3 2ukhra tantashir fi an7a2 al-yaban.
Ta3tamid al-lu3batu 3ala ma3arakati al-fallwja al-thaniya wa 8ad kanat ma3rakat '9arus bayn al-8uwwat Al-amrikiya wal3ira8ya.
"Wa bi-nisba li Sprongboks, intahat silsilat 5 mubarayat ribi7 mutataliya."
"Bi-saref annadhar 3an al-7umma wa iltihab al-7alq, illa annani ash3uru bi-khayr wa fi 7ala jayyida lil muzawalat 3amali 3an bu3ud."
Wa qala al-ba7ith fi khidmat Rift Valley Research fi Athyubia wa musa3id katib dirasa Berhane Asfane:”Hadha ya3ni annahu yajib isti3adat kulla shay2”.
Fi ayamih al-2uwla lam yu3ra'9 al-barnamij ela 3abr mawa8i3 al-bath al-2tha3iy 6awyl al-mada 3abr al-internet TogiNet Radiu wahuwa maw8i3 yurakkuz 3ala al-baramij al-etha3iya.
"Takdheb al sharikat al i3lamiyya 7awla al gharad min dhalik, muda3iyatan annhu ""li tajannubu al qarsana""."
Ma3a ita7at 18 midaliya illa anna 3adad min al-buldan fashila fi al-wusul ila manasat attatwij.
"Wa qala mudir mashru3 Stardust, Tom Duxbury:""Satata7arrak al-markaba min al-sa7el al-gharbi li shamali California wa satunir al-sama2 min hunak 3abra wasat Oregon wa Nevada wa Idaho wusulan ila Yota""."
"Kama howa al-7al m3a jami3 almuntazhat alwataniya fi janub Ifriqia, hunaka rusum siana wa dukhul yawmiya lil 7adiqa."
"Yujad aydhan 3adadun qalil min al-7afilat al-mutajiha shamalan ila Al-Khalil, makan al-dafen attaqlidi li Aba2 al-kitab al-muqaddas Ibrahim, wa Es7aq, wa Ya3qub wa zawjatihim."
Yu2aththir idhtirab nuqs al intibah 3ala al3alaqat m3a aqran akharin li2anna al-atfal al-akharin la yastati3una fahm sabab tasarufihim bi attariqa allati yaf3alun aw sabab tahji2atihim bi attariqa allati yaf3alunaha aw anna mustawa nodhjihim mukhtalif.
Wa tu3adu Faransa sabi3 dawla fi al-iti7ad Al-2urobey tu3any min hatha alvairus. ba3da Annamsa wa Almanya wa Slovenia wa Bulgharia wa Alyunan wa Italya.
"Atlaqat Almanya 3ala al hujum isim ""3amaliyat asad al ba7er"". Fuqidat mu3dham al asli7a al thaqila wal imdadat al lati kana yamtalikuha al jaysh al Britaniy 3enda ijla2ihi min Dunkirk, lidha kana al jaysh da3ifan ila 7adden ma."
"Tustakhdamu al khidma bi shaklin mutakarir 3an tariq ashsha7en, bi ma fi dkhalika qawareb annudhha, wa kadhalika ri7lat al istikshaf al lati ladyha i7tiyajat bayaniyya wa sawt 3an bu3ud."
Tatakawwan al7ayawanat min al3adid min alkhalaya. ya2kulun al ashya2 wa yahdimunaha fi ddakhil. yumkinu li mu3zam al7ayawanat atta7aruk.
"Tu3addu musabaqat arrak9 3abra albalad khilal fasl alshita2, bil idhafa ila attamarin arriyadhiya lil juz2 al3ulwy mina aljism afdhal i3dad li mawsim arrak9."
Wa 3amila khilal fatrat al 80 3ala baramij ka Taxi wa Cheers wa Tracy Ullman.
Qaddama Lakkha Singh 3arid Chhappan bhog bhagan wa rafaqahu al-mughanni Raju Khandelwal.
"A7yanan yuwajih al-musafirun al-ladhin ladayhim waqet sahil fil takayyuf ma3a attaqafa al-jadida, su3ubatan khassa fi i3adat attakayuf ma3a thaqafatihim al-asliyya."
"Tuqaddimu ba3dh al-amakin al-mashrubat al-ku7uliya fil manzil. wa ma3a dhalik, fa 2inna assukr yudh3if qudrat attamyiz, wa jami3 al-muqamirin al-akiffa2 ya3rifuna ahammiyat 2an tabqa mutayaqqidhan."
"Tuqaddimu CafeNet El Sol khidmat 7ajz muqabil rusum qadruha 30 dolar amriki, aw 10 dolarat amrikiya li yawmin wa7id; attafasil 3ala saf7at Corcovado al-khassa bihim."
"Endala3at al-e7tijajat al-lati kanat 3anifa a7yanan bisabab al-ekhfaq fi 3aqd entikhabat, wa ba3dhuha kana muqarrar mundhu 3am 2011."
"Al-khaliya hiya alwi7da alasasiya fi jami3 alka2inat al7aya, wa tatakawwan ajsam jami3 alka2inat al7aya min khaliya wa7ida aw akthar."
"Fi shita2, yumkinuka al-istimta3 bi-ba3dh min afdhal makan li-ttazalluj fi amrika ashamaliya, wa fi ssayf yumkinuka tajribat rukub addarajat al-jabaliya al-asila."
20% min almiyah allaty tasubbu min anhar alkawkab fi almu7itat ta2ti min Al-Amazon.
W kana yuqimu fi funduq al-fariq qabla al-mubarat al-muaqarrar yawm al-a7ad didda Bolonya.
" Wa qala Glen Cushing min Fariq al-mas7 al-jiyoloji al-amriki (USGS) attabi3 li jami3at shamal Arizona al-lati taqa3 fi Flagstaff fi wiliyat Arizona:”Inna sulukahum al-7arari laysa thabitan mithal al-kuhuf al-kabira 3ala al-ared al-lati ghaliban ma tu7afidhu 3ala darajat 7arara thabita ila 7adden ma,lakinani atafiqu ma3 kawniha thuquban 3amiqa”."
Jara tazwyd arrukab bilmiyah athna2 int'6arihim fy darajti 7arartin tablugh 90 daraja fihrinhayt.
"Fi al-3arid al-taqdimi al-ra2isi yawm al-khamis li ma3rad Tokyo lil al3ab, kashfa ra2is Nintendo Satoru Lwata 3an tasmim jihaz Nintendo Revolution al-jadid lil sharika."
Laqad mathalat 7amlat shamal al-atlasy fi al7arb al3alamiya athaniya a7ad abraz al-amthila al7aditha allaty tajdur al-ishara ilayha. laqad 7awala al-amrikan naql arrijal wal 3atad 3abra al-mu7it al-atlasy li musa3adat Britanya.
Yajid alkathir minna nafsahu yushahid 3ardan tilifizyuniyan yukhbiruna bi 3amaliya aw tajriba lan nusharika fiha aw nutabiqa tilka alma3rifa abadan.
A'6harat b7ath 2ujry khilal al-8arn al-3ishhryn anna hunak majmw3atan min al-tanwu3at al-jyniya: makhfiya wa'6ahira.
"Alnitrogen ghazun la yazalu lahu nafs khwas alnitrogen assa2il. Takunu al7ala assa2ila akthara kathaftan, wa lakinna aljuzay2at tadhal kama hiya duna taghyir."
Tashtahir al-Argentin bi-wujud a7ad afdhal firaq wa la3ibi al-polo fil 3alam.
Wa ja2a qarar al-NBA ba3da an uthbitat isabat la3ib fariq Utah Jazz bil Virus.
Qad yatimmu taqyid arru2ya aydhan bi-sabab tasaqut athuluj aw hububiha aw bi-sabab attakthif aw al-jalid 3ala nawafidh assayara.
"Idha kunta turid 2an tara al-3alam bi-thaman zahid, bi-sabab adharura, aw ka-2uslub 7ayat, aw li-tta7addy, fa-hunaka ba3dh atturuq lil-qiyam bi-dhalik."
Ta7arrakat 8uwwat atta7aluf wa al-8uwwat al-Afghaniya ila al-minta8a li ta2min al-maw8i3 wa tamma irsal 6a2irat atta7aluf al-ukhra lil musa3ada.
Jawlat tazzalluj: yutlaq 3ala hadha alnashat aydhan ism attazalluj 3ala al-jalid aw jawlat attazalluj aw attanazzuh 3ala al-jalid.
"Wa ktashafu anna ashames ta3malu wifqa al-mabade2 al-lati ta3malu wifqaha al-nujum: tamma iktishaf anna 7arakat al-nujum madfu3a bi- ida2ataha, wa dawaraniha fa 7aseb."
"Tu3addu fikrat attazalluj qadima lil-ghaya, idh ya3udu tarikh arrusumat al-mawjuda 3ala al-khawf wa allaty tasawwur al-mutazallijin ila 3am 5000 qabla al-milad!"
"Tamma al-3uthur 3ala hadhihi al-nutu2at fi kul an7a2 sati7 al-qamar, wa yabdu annaha ta3aradat lil 7ad al-adna min al-3awamil al-jawwiya. Wa hadha yushiru ila anna al-a7dath al-jawiyya al-lati antajatha kanat 7aditha ila 7adden ma."
Tamma al-eblagh 3an su7ub mudhlima la 3alaqata laha bi ay nashat burkani 3enda qai3dat al-jabal.
"7asala Del Potro 3ala mizat mubakkira filmajmu3a al-thaniya, lakinna hadha tatallaba aydan kasir al-ta3adul ba3da al-wusul ila natijat 6-6."
Tashmal al-riya'9at al-sha3biya kurata al-8adam wakurata al-sala walkura al-6a2ra wkurata al-ma2 walmubarazata walrugby warukwb al-drajat walhwky al-jalyd wahwky al-da7raja wasiba8 al-sayarat F1.
"Satakun al-madina al-ula fi janub sharqi Orobba al-lati tastadifu CowParade, akbar 7adath 3am fil 3alam bayna sharay Yunyu wa Oghustus."
